{
  "schema_version": 1,
  "catalog": "DSFR component instance rules",
  "target_version": "1.15.4",
  "status_policy": {
    "detected_not_audited": "DETECTE_NON_AUDITE",
    "pass": "AUCUN_ECART_REGLES_EXECUTEES",
    "fail": "ECART_OBSERVE",
    "review": "A_CONFIRMER"
  },
  "rules": [
    {
      "rule_id": "DSFR-HEADER-STRUCTURE-001",
      "component": "header",
      "version_scope": "TARGET_VERSION",
      "minimum_version": "1.15.2",
      "selector": ".fr-header",
      "severity": "Bloquant",
      "title": "Structure d’en-tête DSFR incomplète",
      "expected": "Un élément header portant role=banner et contenant .fr-header__body et .fr-container.",
      "expected_html": "<header class=\"fr-header\" role=\"banner\"><div class=\"fr-header__body\"><div class=\"fr-container\">…</div></div></header>",
      "source": "dsfr-components/references/components/structure/header.md",
      "recommendation": "Restaurer l’enveloppe officielle de l’en-tête et conserver une seule région banner de premier niveau.",
      "verification": "Inspecter le DOM rendu puis naviguer par régions après initialisation DSFR.",
      "conditions": [
        {
          "type": "tag_in",
          "values": [
            "HEADER"
          ],
          "message": "La racine .fr-header doit être un élément header."
        },
        {
          "type": "attribute_equals",
          "name": "role",
          "value": "banner",
          "message": "role=banner est absent."
        },
        {
          "type": "descendant_min",
          "selector": ".fr-header__body",
          "min": 1,
          "message": ".fr-header__body est absent."
        },
        {
          "type": "descendant_min",
          "selector": ".fr-container",
          "min": 1,
          "message": ".fr-container est absent de l’en-tête."
        }
      ]
    },
    {
      "rule_id": "DSFR-FOOTER-STRUCTURE-001",
      "component": "footer",
      "version_scope": "TARGET_VERSION",
      "minimum_version": "1.15.2",
      "selector": ".fr-footer",
      "severity": "Bloquant",
      "title": "Structure de pied de page DSFR incomplète",
      "expected": "Un élément footer portant role=contentinfo et contenant .fr-container.",
      "expected_html": "<footer class=\"fr-footer\" role=\"contentinfo\"><div class=\"fr-container\">…</div></footer>",
      "source": "dsfr-components/references/components/structure/footer.md",
      "recommendation": "Utiliser l’enveloppe et les sous-éléments documentés du pied de page DSFR.",
      "verification": "Inspecter la région contentinfo et les liens institutionnels du pied de page.",
      "conditions": [
        {
          "type": "tag_in",
          "values": [
            "FOOTER"
          ],
          "message": "La racine .fr-footer doit être un élément footer."
        },
        {
          "type": "attribute_equals",
          "name": "role",
          "value": "contentinfo",
          "message": "role=contentinfo est absent."
        },
        {
          "type": "descendant_min",
          "selector": ".fr-container",
          "min": 1,
          "message": ".fr-container est absent du pied de page."
        }
      ]
    },
    {
      "rule_id": "DSFR-NAV-STRUCTURE-001",
      "component": "navigation",
      "selector": ".fr-nav:not(.fr-translate)",
      "version_scope": "VERSION_INDEPENDENT",
      "severity": "Bloquant",
      "title": "Navigation DSFR incomplètement nommée ou structurée",
      "expected": "Un élément nav nommé par aria-label et contenant .fr-nav__list.",
      "expected_html": "<nav class=\"fr-nav\" role=\"navigation\" aria-label=\"Menu principal\"><ul class=\"fr-nav__list\">…</ul></nav>",
      "source": "dsfr-components/references/components/navigation/navigation.md",
      "recommendation": "Ne pas utiliser .fr-nav comme classe de présentation ; employer nav, un nom accessible et la liste DSFR documentée.",
      "verification": "Contrôler chaque instance .fr-nav et la navigation par landmarks.",
      "conditions": [
        {
          "type": "tag_in",
          "values": [
            "NAV"
          ],
          "message": "La racine .fr-nav n’est pas un élément nav."
        },
        {
          "type": "attribute_non_empty",
          "name": "aria-label",
          "message": "La navigation ne possède pas de nom via aria-label."
        },
        {
          "type": "descendant_min",
          "selector": ".fr-nav__list",
          "min": 1,
          "message": ".fr-nav__list est absent."
        }
      ]
    },
    {
      "rule_id": "DSFR-TRANSLATE-STRUCTURE-001",
      "component": "translate",
      "version_scope": "TARGET_VERSION",
      "minimum_version": "1.15.2",
      "selector": ".fr-translate",
      "severity": "Majeur",
      "title": "Sélecteur de langue DSFR incomplet",
      "expected": "Le sélecteur utilise un div, un bouton typé contrôlant un menu identifié et des liens de langue avec lang et hreflang.",
      "expected_html": "<div class=\"fr-translate fr-nav\"><div class=\"fr-nav__item\"><button type=\"button\" class=\"fr-translate__btn fr-btn\" aria-controls=\"translate-menu\" aria-expanded=\"false\">FR</button><div id=\"translate-menu\" class=\"fr-collapse fr-translate__menu fr-menu\"><ul class=\"fr-menu__list\"><li><a class=\"fr-translate__language\" lang=\"fr\" hreflang=\"fr\">FR - Français</a></li></ul></div></div></div>",
      "source": "dsfr-components/references/components/navigation/translate.md",
      "recommendation": "Utiliser la structure documentée et déclarer type=button sur le déclencheur.",
      "verification": "Ouvrir le sélecteur au clavier et contrôler le menu, les langues et le retour du focus.",
      "conditions": [
        {
          "type": "tag_in",
          "values": [
            "DIV"
          ],
          "message": "La racine fr-translate n’est pas un div."
        },
        {
          "type": "descendant_min",
          "selector": ".fr-nav__item",
          "min": 1,
          "message": "fr-nav__item est absent."
        },
        {
          "type": "descendant_min",
          "selector": ".fr-translate__btn[type=\"button\"][aria-controls][aria-expanded]",
          "min": 1,
          "message": "Le bouton de langue n’est pas typé ou ne déclare pas son état et sa cible."
        },
        {
          "type": "descendant_min",
          "selector": ".fr-translate__menu.fr-menu.fr-collapse[id] .fr-menu__list",
          "min": 1,
          "message": "Le menu de langues identifié est absent."
        },
        {
          "type": "descendant_min",
          "selector": ".fr-translate__language[lang][hreflang]",
          "min": 1,
          "message": "Aucun lien de langue ne déclare lang et hreflang."
        }
      ]
    },
    {
      "rule_id": "DSFR-SEARCH-STRUCTURE-001",
      "component": "search",
      "selector": ".fr-search-bar",
      "version_scope": "VERSION_INDEPENDENT",
      "severity": "Bloquant",
      "title": "Barre de recherche DSFR incomplète",
      "expected": "Une barre incluse dans une région search avec un champ étiqueté et un bouton ; depuis DSFR 1.15.3 (#1516), fr-search-bar--labelled rend le libellé visible, hors recherche globale du header.",
      "expected_html": "<form class=\"fr-search-bar\" role=\"search\"><label class=\"fr-label\" for=\"search\">Rechercher</label><input class=\"fr-input\" id=\"search\"><button class=\"fr-btn\">Rechercher</button></form>",
      "source": "dsfr-components/references/components/forms-services/search.md",
      "recommendation": "Associer le champ à un label persistant et exposer la région de recherche.",
      "verification": "Vérifier le nom du champ, le bouton et la région search dans l’arbre d’accessibilité.",
      "conditions": [
        {
          "type": "ancestor_or_self_attribute",
          "name": "role",
          "value": "search",
          "message": "Aucun ancêtre ou élément ne porte role=search."
        },
        {
          "type": "attribute_not_values",
          "name": "aria-hidden",
          "values": [
            "true"
          ],
          "message": "La barre de recherche active reste exposée avec aria-hidden=true."
        },
        {
          "type": "descendant_min",
          "selector": "input",
          "min": 1,
          "message": "Le champ de recherche est absent."
        },
        {
          "type": "descendant_labelled",
          "selector": "input",
          "message": "Un champ de recherche ne possède pas de label accessible."
        },
        {
          "type": "descendant_min",
          "selector": "button",
          "min": 1,
          "message": "Le bouton de recherche est absent."
        }
      ]
    },
    {
      "rule_id": "DSFR-CONSENT-STRUCTURE-001",
      "component": "consent",
      "version_scope": "TARGET_VERSION",
      "minimum_version": "1.15.2",
      "selector": ".fr-consent-banner",
      "severity": "Majeur",
      "title": "Bandeau de consentement DSFR incomplet",
      "expected": "Un titre et au moins deux actions explicites dans le bandeau.",
      "expected_html": "<div class=\"fr-consent-banner\"><h2>À propos des cookies</h2><div class=\"fr-consent-banner__buttons\"><button class=\"fr-btn\">…</button></div></div>",
      "source": "dsfr-components/references/components/structure/consent.md",
      "recommendation": "Conserver le titre et les actions documentées, avec des noms accessibles explicites.",
      "verification": "Exercer accepter, refuser et personnaliser au clavier.",
      "conditions": [
        {
          "type": "descendant_min",
          "selector": "h1,h2,h3,h4,h5,h6",
          "min": 1,
          "message": "Le bandeau ne possède pas de titre."
        },
        {
          "type": "descendant_min",
          "selector": ".fr-btn",
          "min": 2,
          "message": "Le bandeau ne possède pas au moins deux actions DSFR."
        }
      ]
    },
    {
      "rule_id": "DSFR-MODAL-STRUCTURE-001",